{
  "name": "caller",
  "engineVersion": "v0.19.7",
  "sdk": {
    "source": "github.com/pjmagee/dagger/sdk/csharp@dotnet-module-support"
  },
  "dependencies": [
    {
      "name": "impl",
      "source": "impl"
    },
    {
      "name": "test",
      "source": "test"
    }
  ],
  "disableDefaultFunctionCaching": true
}
