{
  "name": "all-sdks",
  "engineVersion": "v0.21.8",
  "sdk": {
    "source": "go"
  },
  "include": [
    "../../go.sum",
    "../../go.mod",
    "../../util/parallel"
  ],
  "dependencies": [
    {
      "name": "dotnet-sdk-dev",
      "source": "../dotnet-sdk-dev"
    },
    {
      "name": "go-sdk-dev",
      "source": "../go-sdk-dev"
    },
    {
      "name": "java-sdk-dev",
      "source": "../java-sdk-dev"
    },
    {
      "name": "php-sdk-dev",
      "source": "../php-sdk-dev"
    },
    {
      "name": "python-sdk-dev",
      "source": "../python-sdk-dev"
    },
    {
      "name": "rust-sdk-dev",
      "source": "../rust-sdk-dev"
    },
    {
      "name": "typescript-sdk-dev",
      "source": "../typescript-sdk-dev"
    },
    {
      "name": "elixir-sdk-dev",
      "source": "../elixir-sdk-dev"
    }
  ],
  "codegen": {
    "automaticGitignore": false
  }
}
