{
  "name": "php-sdk-dev",
  "engineVersion": "v0.21.9",
  "sdk": {
    "source": "go"
  },
  "include": [
    "../../go.sum",
    "../../go.mod",
    "../../util/parallel"
  ],
  "dependencies": [
    {
      "name": "dagger-engine",
      "source": "../engine-dev"
    },
    {
      "name": "git-releaser",
      "source": "../../modules/git-releaser"
    }
  ],
  "codegen": {
    "automaticGitignore": false
  }
}
