{
  "name": "my-module",
  "engineVersion": "v0.15.2",
  "sdk": {
    "source": "php"
  },
  "dependencies": [
    {
      "name": "golang",
      "source": "github.com/kpenfound/dagger-modules/golang@golang/v0.2.0",
      "pin": "a22ea31658571ece79016162ecedabb7f7defe6a"
    }
  ],
  "source": "."
}
