{
  "name": "dagger-engine",
  "engineVersion": "v0.19.7",
  "sdk": {
    "source": "go"
  },
  "include": [
    "../../engine/distconsts/**/*",
    "../../sdk/typescript/runtime/**/*",
    "../../go.mod",
    "../../go.sum",
    "../../util/parallel"
  ],
  "dependencies": [
    {
      "name": "alpine",
      "source": "../../modules/alpine"
    },
    {
      "name": "codegen",
      "source": "../codegen"
    },
    {
      "name": "dagger-cli",
      "source": "../dagger"
    },
    {
      "name": "go",
      "source": "../../modules/go"
    },
    {
      "name": "version",
      "source": "../../version"
    },
    {
      "name": "wolfi",
      "source": "../../modules/wolfi"
    }
  ],
  "source": ".dagger",
  "codegen": {
    "automaticGitignore": false
  }
}
