{
  "name": "dagger-cli",
  "engineVersion": "v0.18.5",
  "sdk": {
    "source": "go"
  },
  "dependencies": [
    {
      "name": "alpine",
      "source": "../../modules/alpine"
    },
    {
      "name": "go",
      "source": "../../modules/go"
    },
    {
      "name": "version",
      "source": "../../version"
    }
  ],
  "source": ".dagger"
}
