{
  "name": "cli-dev",
  "engineVersion": "v0.21.8",
  "sdk": {
    "source": "go"
  },
  "include": [
    "../../go.mod",
    "../../go.sum",
    "../../util/parallel"
  ],
  "dependencies": [
    {
      "name": "alpine",
      "source": "../../modules/alpine"
    },
    {
      "name": "go",
      "source": "../go"
    },
    {
      "name": "version",
      "source": "../../version"
    }
  ],
  "codegen": {
    "automaticGitignore": false
  }
}
