{
  "name": "typescript-sdk-dev",
  "engineVersion": "v0.21.9",
  "sdk": {
    "source": "dang"
  },
  "include": [
    "is-semver"
  ],
  "dependencies": [
    {
      "name": "codegen",
      "source": "../../cmd/codegen"
    },
    {
      "name": "dagger-engine",
      "source": "../engine-dev"
    },
    {
      "name": "go",
      "source": "../go"
    }
  ]
}
