{
  "name": "python-sdk-dev",
  "engineVersion": "v0.21.8",
  "sdk": {
    "source": "go"
  },
  "include": [
    "../../go.sum",
    "../../go.mod",
    "../../util/parallel",
    "../../util/dockerfileextractor",
    "../../sdk/python/runtime/images"
  ],
  "dependencies": [
    {
      "name": "dagger-engine",
      "source": "../engine-dev"
    },
    {
      "name": "dockerd",
      "source": "dockerd"
    },
    {
      "name": "pytest",
      "source": "github.com/dagger/pytest@main",
      "pin": "cdf6dc0bce0fe8fdf87c6b26ecd991e6f96200b0"
    },
    {
      "name": "wolfi",
      "source": "../../modules/wolfi"
    }
  ],
  "codegen": {
    "automaticGitignore": false
  }
}
