{
  "name": "python-sdk-dev",
  "engineVersion": "v0.18.17",
  "sdk": {
    "source": "python"
  },
  "include": [
    "!**/.venv",
    "!**/__pycache__",
    "!**/.*cache",
    "!.*",
    ".git*",
    "!sdk"
  ],
  "dependencies": [
    {
      "name": "dockerd",
      "source": "github.com/kpenfound/dagger-modules/dockerd@main",
      "pin": "f7964245d0146dd3810f247c6c09eb33518d4654"
    },
    {
      "name": "wolfi",
      "source": "../../../modules/wolfi"
    }
  ]
}
